{
  "format": "littlewild-3d-asset",
  "schemaVersion": 1,
  "category": "item",
  "id": "beams",
  "name": "Timber beams",
  "materials": {
    "primary": "#9a7148",
    "light": "#d9c69d",
    "dark": "#84694d",
    "metal": "#9ba6a0"
  },
  "models": {
    "carry": {
      "nodes": [
        {
          "primitive": "box",
          "id": "plank-a",
          "position": [
            0,
            0.08,
            -0.08
          ],
          "scale": [
            0.54,
            0.08,
            0.12
          ],
          "material": "primary"
        },
        {
          "primitive": "box",
          "id": "plank-b",
          "position": [
            0,
            0.16,
            0.05
          ],
          "scale": [
            0.54,
            0.08,
            0.12
          ],
          "material": "light"
        },
        {
          "primitive": "box",
          "id": "strap",
          "position": [
            0,
            0.13,
            0
          ],
          "scale": [
            0.06,
            0.22,
            0.32
          ],
          "material": "dark"
        }
      ]
    }
  },
  "metadata": {
    "radius": 0.6
  }
}
