{
  "format": "littlewild-3d-asset",
  "schemaVersion": 1,
  "category": "item",
  "id": "stargazer_hat",
  "name": "Stargazer hat",
  "materials": {
    "primary": "#797ca4",
    "light": "#e7d3a5",
    "dark": "#7d674f",
    "metal": "#a5b1aa",
    "glow": {
      "color": "#e7bd73",
      "emissive": "#d99d49",
      "emissiveIntensity": 0.45
    }
  },
  "models": {
    "equipped": {
      "nodes": [
        {
          "primitive": "cylinder",
          "id": "brim",
          "position": [
            0,
            0.02,
            0
          ],
          "scale": [
            0.31,
            0.03,
            0.27
          ],
          "material": "primary"
        },
        {
          "primitive": "cone",
          "id": "cone",
          "position": [
            0,
            0.22,
            -0.02
          ],
          "scale": [
            0.19,
            0.42,
            0.18
          ],
          "material": "primary",
          "rotation": [
            0,
            0,
            -0.13
          ]
        },
        {
          "primitive": "ball",
          "id": "star",
          "position": [
            0.12,
            0.37,
            0
          ],
          "scale": [
            0.025,
            0.035,
            0.02
          ],
          "material": "light"
        }
      ]
    }
  },
  "metadata": {
    "equipment": true,
    "slot": "head",
    "visual": "wizard",
    "radius": 0.45
  }
}
