{
  "format": "littlewild-3d-asset",
  "schemaVersion": 1,
  "category": "item",
  "id": "gathering_axe",
  "name": "Gathering axe",
  "materials": {
    "primary": "#89a3a4",
    "light": "#e7d3a5",
    "dark": "#7d674f",
    "metal": "#a5b1aa",
    "glow": {
      "color": "#e7bd73",
      "emissive": "#d99d49",
      "emissiveIntensity": 0.45
    }
  },
  "models": {
    "equipped": {
      "nodes": [
        {
          "primitive": "cylinder",
          "id": "handle",
          "position": [
            0,
            -0.08,
            0
          ],
          "scale": [
            0.022,
            0.46,
            0.022
          ],
          "material": "dark"
        },
        {
          "primitive": "box",
          "id": "head",
          "position": [
            0.06,
            0.16,
            0
          ],
          "scale": [
            0.22,
            0.16,
            0.055
          ],
          "material": "primary"
        },
        {
          "primitive": "box",
          "id": "edge",
          "position": [
            0.15,
            0.14,
            0
          ],
          "scale": [
            0.025,
            0.18,
            0.06
          ],
          "material": "metal"
        }
      ]
    }
  },
  "metadata": {
    "equipment": true,
    "slot": "tool",
    "visual": "axe",
    "radius": 0.45
  }
}
