{
  "format": "littlewild-3d-asset",
  "schemaVersion": 1,
  "category": "item",
  "id": "berries",
  "name": "Berries",
  "materials": {
    "leaf": "#6f9968",
    "leaf2": "#9eb87b",
    "fruit": "#bb7465",
    "basket": "#a98a61"
  },
  "models": {
    "world": {
      "nodes": [
        {
          "primitive": "soft",
          "id": "bush-a",
          "position": [
            0,
            0.22,
            0
          ],
          "scale": [
            0.3,
            0.26,
            0.28
          ],
          "material": "leaf"
        },
        {
          "primitive": "soft",
          "id": "bush-b",
          "position": [
            0.2,
            0.25,
            -0.1
          ],
          "scale": [
            0.23,
            0.23,
            0.23
          ],
          "material": "leaf2"
        },
        {
          "primitive": "soft",
          "id": "bush-c",
          "position": [
            -0.18,
            0.18,
            0.11
          ],
          "scale": [
            0.2,
            0.17,
            0.18
          ],
          "material": "leaf"
        },
        {
          "primitive": "ball",
          "id": "berry-0",
          "position": [
            0.24,
            0.31,
            0
          ],
          "scale": [
            0.047,
            0.049,
            0.047
          ],
          "material": "fruit"
        },
        {
          "primitive": "ball",
          "id": "berry-1",
          "position": [
            -0.09987524077131417,
            0.39,
            0.2091384081699068
          ],
          "scale": [
            0.047,
            0.049,
            0.047
          ],
          "material": "fruit"
        },
        {
          "primitive": "ball",
          "id": "berry-2",
          "position": [
            -0.15687446900726687,
            0.31,
            -0.1740645739208235
          ],
          "scale": [
            0.047,
            0.049,
            0.047
          ],
          "material": "fruit"
        },
        {
          "primitive": "ball",
          "id": "berry-3",
          "position": [
            0.23044086879608783,
            0.39,
            -0.06426556458575296
          ],
          "scale": [
            0.047,
            0.049,
            0.047
          ],
          "material": "fruit"
        },
        {
          "primitive": "ball",
          "id": "berry-4",
          "position": [
            -0.03492000811406725,
            0.31,
            0.22755239672337782
          ],
          "scale": [
            0.047,
            0.049,
            0.047
          ],
          "material": "fruit"
        },
        {
          "primitive": "ball",
          "id": "berry-5",
          "position": [
            -0.20137716697834857,
            0.39,
            -0.12512485550455504
          ],
          "scale": [
            0.047,
            0.049,
            0.047
          ],
          "material": "fruit"
        },
        {
          "primitive": "ball",
          "id": "berry-6",
          "position": [
            0.2025249500957981,
            0.31,
            -0.12341177114010005
          ],
          "scale": [
            0.047,
            0.049,
            0.047
          ],
          "material": "fruit"
        }
      ]
    },
    "carry": {
      "nodes": [
        {
          "primitive": "cylinder",
          "id": "basket",
          "position": [
            0,
            0.12,
            0
          ],
          "scale": [
            0.13,
            0.18,
            0.12
          ],
          "material": "basket"
        },
        {
          "primitive": "ball",
          "id": "fruit-0",
          "position": [
            -0.07,
            0.22,
            0
          ],
          "scale": [
            0.05,
            0.045,
            0.05
          ],
          "material": "fruit"
        },
        {
          "primitive": "ball",
          "id": "fruit-1",
          "position": [
            0,
            0.22,
            0
          ],
          "scale": [
            0.05,
            0.045,
            0.05
          ],
          "material": "fruit"
        },
        {
          "primitive": "ball",
          "id": "fruit-2",
          "position": [
            0.07,
            0.22,
            0
          ],
          "scale": [
            0.05,
            0.045,
            0.05
          ],
          "material": "fruit"
        }
      ]
    }
  },
  "metadata": {
    "radius": 0.6,
    "worldHitHeight": 0.65
  }
}
