{
  "format": "littlewild-3d-asset",
  "schemaVersion": 1,
  "category": "item",
  "id": "woodland_vest",
  "name": "Woodland vest",
  "materials": {
    "primary": "#737853",
    "light": "#e7d3a5",
    "dark": "#7d674f",
    "metal": "#a5b1aa",
    "glow": {
      "color": "#e7bd73",
      "emissive": "#d99d49",
      "emissiveIntensity": 0.45
    }
  },
  "models": {
    "equipped": {
      "nodes": [
        {
          "primitive": "cylinder",
          "id": "vest",
          "position": [
            0,
            0,
            0
          ],
          "scale": [
            0.24,
            0.25,
            0.22
          ],
          "material": "primary"
        },
        {
          "primitive": "box",
          "id": "front",
          "position": [
            0,
            0.04,
            0.22
          ],
          "scale": [
            0.15,
            0.19,
            0.018
          ],
          "material": "light"
        },
        {
          "primitive": "ball",
          "id": "button-a",
          "position": [
            0,
            0.08,
            0.24
          ],
          "scale": [
            0.015,
            0.015,
            0.01
          ],
          "material": "metal"
        },
        {
          "primitive": "ball",
          "id": "button-b",
          "position": [
            0,
            0.01,
            0.24
          ],
          "scale": [
            0.015,
            0.015,
            0.01
          ],
          "material": "metal"
        }
      ]
    }
  },
  "metadata": {
    "equipment": true,
    "slot": "body",
    "visual": "vest",
    "radius": 0.45
  }
}
