{
  "format": "littlewild-3d-asset",
  "schemaVersion": 1,
  "category": "item",
  "id": "wood",
  "name": "Inbound blanks",
  "materials": {
    "box": "#ba9d74",
    "label": "#f4eddd"
  },
  "models": {
    "world": {
      "nodes": [
        {
          "primitive": "box",
          "position": [
            0,
            0.1,
            0
          ],
          "scale": [
            0.32,
            0.22,
            0.26
          ],
          "material": "box"
        },
        {
          "primitive": "box",
          "position": [
            0,
            0.14,
            0.14
          ],
          "scale": [
            0.14,
            0.08,
            0.012
          ],
          "material": "label"
        }
      ]
    },
    "carry": {
      "nodes": [
        {
          "primitive": "box",
          "position": [
            0,
            0.1,
            0
          ],
          "scale": [
            0.32,
            0.22,
            0.26
          ],
          "material": "box"
        },
        {
          "primitive": "box",
          "position": [
            0,
            0.14,
            0.14
          ],
          "scale": [
            0.14,
            0.08,
            0.012
          ],
          "material": "label"
        }
      ]
    }
  },
  "metadata": {
    "radius": 0.6,
    "worldHitHeight": 2
  }
}
