{
  "format": "littlewild-3d-asset",
  "schemaVersion": 1,
  "category": "item",
  "id": "groundwater",
  "name": "Groundwater",
  "materials": {
    "water": "#81b1a7",
    "stone": "#a9b4a7"
  },
  "models": {
    "world": {
      "nodes": [
        {
          "primitive": "soft",
          "id": "spring",
          "position": [
            0,
            0.08,
            0
          ],
          "scale": [
            0.28,
            0.09,
            0.23
          ],
          "material": "water"
        },
        {
          "primitive": "ball",
          "id": "stone-0",
          "position": [
            -0.22,
            0.08,
            0.08
          ],
          "scale": [
            0.1,
            0.07,
            0.1
          ],
          "material": "stone"
        },
        {
          "primitive": "ball",
          "id": "stone-1",
          "position": [
            0.22,
            0.08,
            0.08
          ],
          "scale": [
            0.1,
            0.07,
            0.1
          ],
          "material": "stone"
        }
      ]
    }
  },
  "metadata": {
    "radius": 0.6,
    "worldHitHeight": 0.2
  }
}
