{
  "format": "littlewild-3d-asset",
  "schemaVersion": 1,
  "category": "building",
  "id": "map_table",
  "name": "Map table",
  "materials": {
    "table": "#b79569",
    "wood": "#856c4f",
    "paper": "#eee1b9",
    "green": "#8faf94",
    "blue": "#97b9b4",
    "pin": "#c98768",
    "ink": "#75614e"
  },
  "models": {
    "world": {
      "nodes": [
        {
          "primitive": "box",
          "id": "tabletop",
          "position": [
            0,
            0.55,
            0
          ],
          "scale": [
            1.15,
            0.12,
            0.82
          ],
          "material": "table"
        },
        {
          "primitive": "box",
          "id": "leg-0-0",
          "position": [
            -0.44,
            0.27,
            -0.28
          ],
          "scale": [
            0.09,
            0.54,
            0.09
          ],
          "material": "wood"
        },
        {
          "primitive": "box",
          "id": "leg-0-1",
          "position": [
            -0.44,
            0.27,
            0.28
          ],
          "scale": [
            0.09,
            0.54,
            0.09
          ],
          "material": "wood"
        },
        {
          "primitive": "box",
          "id": "leg-1-0",
          "position": [
            0.44,
            0.27,
            -0.28
          ],
          "scale": [
            0.09,
            0.54,
            0.09
          ],
          "material": "wood"
        },
        {
          "primitive": "box",
          "id": "leg-1-1",
          "position": [
            0.44,
            0.27,
            0.28
          ],
          "scale": [
            0.09,
            0.54,
            0.09
          ],
          "material": "wood"
        },
        {
          "primitive": "box",
          "id": "map",
          "position": [
            0,
            0.625,
            0
          ],
          "scale": [
            0.88,
            0.025,
            0.62
          ],
          "material": "paper"
        },
        {
          "primitive": "box",
          "id": "forest-mark",
          "position": [
            -0.12,
            0.645,
            0.02
          ],
          "scale": [
            0.32,
            0.008,
            0.24
          ],
          "material": "green",
          "rotation": [
            0,
            0.2,
            0
          ]
        },
        {
          "primitive": "box",
          "id": "water-mark",
          "position": [
            0.26,
            0.646,
            -0.12
          ],
          "scale": [
            0.2,
            0.008,
            0.14
          ],
          "material": "blue",
          "rotation": [
            0,
            -0.3,
            0
          ]
        },
        {
          "primitive": "box",
          "id": "pin",
          "position": [
            -0.34,
            0.655,
            0.18
          ],
          "scale": [
            0.05,
            0.045,
            0.05
          ],
          "material": "pin"
        },
        {
          "primitive": "cylinder",
          "id": "ink-pot",
          "position": [
            0.36,
            0.67,
            0.18
          ],
          "scale": [
            0.07,
            0.07,
            0.07
          ],
          "material": "ink"
        }
      ]
    }
  },
  "metadata": {
    "orientation": "none",
    "indoor": false,
    "hitHeight": 0.82,
    "radius": 1
  }
}
