{
  "format": "littlewild-3d-asset",
  "schemaVersion": 1,
  "category": "building",
  "id": "workshop",
  "name": "Assembly station",
  "materials": {
    "frame": "#536b7b",
    "surface": "#e5ddc9",
    "box": "#b89871",
    "label": "#f2eddf",
    "screen": "#69a4b3",
    "dark": "#2b4353",
    "seat": "#6f91a0"
  },
  "models": {
    "world": {
      "nodes": [
        {
          "primitive": "box",
          "position": [
            0,
            0.7,
            0
          ],
          "scale": [
            1.35,
            0.09,
            0.8
          ],
          "material": "surface"
        },
        {
          "primitive": "box",
          "position": [
            -0.5,
            0.35,
            0
          ],
          "scale": [
            0.07,
            0.7,
            0.6
          ],
          "material": "frame"
        },
        {
          "primitive": "box",
          "position": [
            0.5,
            0.35,
            0
          ],
          "scale": [
            0.07,
            0.7,
            0.6
          ],
          "material": "frame"
        },
        {
          "primitive": "box",
          "position": [
            -0.22,
            0.87,
            0
          ],
          "scale": [
            0.55,
            0.27,
            0.4
          ],
          "material": "box"
        },
        {
          "primitive": "box",
          "position": [
            -0.22,
            0.91,
            0.21
          ],
          "scale": [
            0.26,
            0.1,
            0.012
          ],
          "material": "label"
        },
        {
          "primitive": "box",
          "position": [
            0.43,
            0.81,
            0
          ],
          "scale": [
            0.16,
            0.1,
            0.25
          ],
          "material": "screen"
        }
      ]
    }
  },
  "metadata": {
    "radius": 0.85,
    "hitHeight": 1.7
  },
  "behaviors": {}
}
