{
  "format": "littlewild-3d-asset",
  "schemaVersion": 1,
  "category": "building",
  "id": "bench",
  "name": "Workbench",
  "materials": {
    "wood": "#bd9b70",
    "dark": "#8d704f",
    "paper": "#e2c69a",
    "accent": "#778d7d",
    "cloth": "#b78d76",
    "metal": "#9da9a1",
    "stone": "#b89b83",
    "fire": {
      "color": "#e5a15e",
      "emissive": "#cb7541",
      "emissiveIntensity": 0.45
    }
  },
  "models": {
    "world": {
      "nodes": [
        {
          "primitive": "box",
          "id": "top",
          "position": [
            0,
            0.56,
            0
          ],
          "scale": [
            0.98,
            0.11,
            0.68
          ],
          "material": "wood"
        },
        {
          "primitive": "box",
          "id": "leg-0",
          "position": [
            -0.38,
            0.28,
            -0.23
          ],
          "scale": [
            0.09,
            0.56,
            0.09
          ],
          "material": "dark"
        },
        {
          "primitive": "box",
          "id": "leg-1",
          "position": [
            0.38,
            0.28,
            -0.23
          ],
          "scale": [
            0.09,
            0.56,
            0.09
          ],
          "material": "dark"
        },
        {
          "primitive": "box",
          "id": "leg-2",
          "position": [
            -0.38,
            0.28,
            0.23
          ],
          "scale": [
            0.09,
            0.56,
            0.09
          ],
          "material": "dark"
        },
        {
          "primitive": "box",
          "id": "leg-3",
          "position": [
            0.38,
            0.28,
            0.23
          ],
          "scale": [
            0.09,
            0.56,
            0.09
          ],
          "material": "dark"
        },
        {
          "primitive": "box",
          "id": "workpiece",
          "position": [
            -0.14,
            0.68,
            0.05
          ],
          "scale": [
            0.55,
            0.13,
            0.15
          ],
          "material": "paper",
          "rotation": [
            0,
            0.12,
            0
          ]
        },
        {
          "primitive": "box",
          "id": "tool",
          "position": [
            0.29,
            0.71,
            -0.1
          ],
          "scale": [
            0.08,
            0.24,
            0.08
          ],
          "material": "metal"
        },
        {
          "primitive": "box",
          "id": "vice",
          "position": [
            0.36,
            0.66,
            0.18
          ],
          "scale": [
            0.18,
            0.18,
            0.16
          ],
          "material": "accent"
        }
      ]
    }
  },
  "metadata": {
    "orientation": "none",
    "indoor": false,
    "hitHeight": 1.15,
    "radius": 1.05
  }
}
