{
  "format": "littlewild-3d-asset",
  "schemaVersion": 1,
  "category": "building",
  "id": "market",
  "name": "Market stall",
  "materials": {
    "post": "#9e7d59",
    "awningA": "#f0ddbd",
    "awningB": "#c78674",
    "wood": "#ad865b",
    "crate": "#b08a60",
    "basket": "#aa8b65",
    "produceA": "#8faa65",
    "produceB": "#c17b68"
  },
  "models": {
    "world": {
      "nodes": [
        {
          "primitive": "box",
          "id": "post-0-0",
          "position": [
            -0.54,
            0.67,
            -0.36
          ],
          "scale": [
            0.065,
            1.34,
            0.065
          ],
          "material": "post"
        },
        {
          "primitive": "box",
          "id": "post-0-1",
          "position": [
            -0.54,
            0.67,
            0.36
          ],
          "scale": [
            0.065,
            1.34,
            0.065
          ],
          "material": "post"
        },
        {
          "primitive": "box",
          "id": "post-1-0",
          "position": [
            0.54,
            0.67,
            -0.36
          ],
          "scale": [
            0.065,
            1.34,
            0.065
          ],
          "material": "post"
        },
        {
          "primitive": "box",
          "id": "post-1-1",
          "position": [
            0.54,
            0.67,
            0.36
          ],
          "scale": [
            0.065,
            1.34,
            0.065
          ],
          "material": "post"
        },
        {
          "primitive": "box",
          "id": "awning-0",
          "position": [
            -0.52,
            1.34,
            0
          ],
          "scale": [
            0.21,
            0.12,
            1.06
          ],
          "material": "awningA"
        },
        {
          "primitive": "box",
          "id": "awning-1",
          "position": [
            -0.31200000000000006,
            1.34,
            0
          ],
          "scale": [
            0.21,
            0.12,
            1.06
          ],
          "material": "awningB"
        },
        {
          "primitive": "box",
          "id": "awning-2",
          "position": [
            -0.10400000000000004,
            1.34,
            0
          ],
          "scale": [
            0.21,
            0.12,
            1.06
          ],
          "material": "awningA"
        },
        {
          "primitive": "box",
          "id": "awning-3",
          "position": [
            0.10399999999999998,
            1.34,
            0
          ],
          "scale": [
            0.21,
            0.12,
            1.06
          ],
          "material": "awningB"
        },
        {
          "primitive": "box",
          "id": "awning-4",
          "position": [
            0.31199999999999994,
            1.34,
            0
          ],
          "scale": [
            0.21,
            0.12,
            1.06
          ],
          "material": "awningA"
        },
        {
          "primitive": "box",
          "id": "awning-5",
          "position": [
            0.52,
            1.34,
            0
          ],
          "scale": [
            0.21,
            0.12,
            1.06
          ],
          "material": "awningB"
        },
        {
          "primitive": "box",
          "id": "counter",
          "position": [
            0,
            0.4,
            0.2
          ],
          "scale": [
            1.08,
            0.14,
            0.44
          ],
          "material": "wood"
        },
        {
          "primitive": "box",
          "id": "crate-left",
          "position": [
            -0.34,
            0.16,
            -0.14
          ],
          "scale": [
            0.28,
            0.28,
            0.28
          ],
          "material": "crate"
        },
        {
          "primitive": "box",
          "id": "crate-right",
          "position": [
            0.34,
            0.16,
            -0.14
          ],
          "scale": [
            0.28,
            0.28,
            0.28
          ],
          "material": "crate"
        },
        {
          "primitive": "cylinder",
          "id": "basket",
          "position": [
            0,
            0.2,
            -0.16
          ],
          "scale": [
            0.18,
            0.27,
            0.18
          ],
          "material": "basket"
        },
        {
          "primitive": "ball",
          "id": "produce-0",
          "position": [
            -0.12,
            0.37,
            -0.16
          ],
          "scale": [
            0.06,
            0.055,
            0.06
          ],
          "material": "produceA"
        },
        {
          "primitive": "ball",
          "id": "produce-1",
          "position": [
            0,
            0.37,
            -0.16
          ],
          "scale": [
            0.06,
            0.055,
            0.06
          ],
          "material": "produceB"
        },
        {
          "primitive": "ball",
          "id": "produce-2",
          "position": [
            0.12,
            0.37,
            -0.16
          ],
          "scale": [
            0.06,
            0.055,
            0.06
          ],
          "material": "produceA"
        }
      ]
    }
  },
  "metadata": {
    "orientation": "none",
    "indoor": false,
    "hitHeight": 1.52,
    "radius": 1.25
  }
}
