{
  "format": "littlewild-3d-asset",
  "schemaVersion": 1,
  "category": "item",
  "id": "herbs",
  "name": "Herbs",
  "materials": {
    "leaf": "#89a984",
    "light": "#b0c19e",
    "flower": "#e5ddbd",
    "dark": "#6f8c69"
  },
  "models": {
    "world": {
      "nodes": [
        {
          "primitive": "cylinder",
          "id": "stem-0",
          "position": [
            -0.18,
            0.19,
            0
          ],
          "scale": [
            0.015,
            0.36,
            0.015
          ],
          "material": "dark"
        },
        {
          "primitive": "soft",
          "id": "leaf-0",
          "position": [
            -0.22,
            0.32,
            0.03
          ],
          "scale": [
            0.14,
            0.16,
            0.1
          ],
          "material": "leaf"
        },
        {
          "primitive": "cylinder",
          "id": "stem-1",
          "position": [
            0,
            0.19,
            0
          ],
          "scale": [
            0.015,
            0.36,
            0.015
          ],
          "material": "dark"
        },
        {
          "primitive": "soft",
          "id": "leaf-1",
          "position": [
            0,
            0.32,
            0.03
          ],
          "scale": [
            0.14,
            0.16,
            0.1
          ],
          "material": "light"
        },
        {
          "primitive": "cylinder",
          "id": "stem-2",
          "position": [
            0.18,
            0.19,
            0
          ],
          "scale": [
            0.015,
            0.36,
            0.015
          ],
          "material": "dark"
        },
        {
          "primitive": "soft",
          "id": "leaf-2",
          "position": [
            0.22,
            0.32,
            0.03
          ],
          "scale": [
            0.14,
            0.16,
            0.1
          ],
          "material": "leaf"
        },
        {
          "primitive": "ball",
          "id": "flower",
          "position": [
            0.03,
            0.46,
            0
          ],
          "scale": [
            0.05,
            0.03,
            0.05
          ],
          "material": "flower"
        }
      ]
    },
    "carry": {
      "nodes": [
        {
          "primitive": "cylinder",
          "id": "stem-a",
          "position": [
            -0.06,
            0.15,
            0
          ],
          "scale": [
            0.02,
            0.36,
            0.02
          ],
          "material": "dark",
          "rotation": [
            0,
            0,
            0.14
          ]
        },
        {
          "primitive": "cylinder",
          "id": "stem-b",
          "position": [
            0.05,
            0.15,
            0
          ],
          "scale": [
            0.02,
            0.38,
            0.02
          ],
          "material": "dark",
          "rotation": [
            0,
            0,
            -0.14
          ]
        },
        {
          "primitive": "soft",
          "id": "leaf-a",
          "position": [
            -0.09,
            0.25,
            0
          ],
          "scale": [
            0.1,
            0.12,
            0.08
          ],
          "material": "leaf"
        },
        {
          "primitive": "soft",
          "id": "leaf-b",
          "position": [
            0.09,
            0.25,
            0
          ],
          "scale": [
            0.1,
            0.12,
            0.08
          ],
          "material": "light"
        },
        {
          "primitive": "box",
          "id": "tie",
          "position": [
            0,
            0.08,
            0
          ],
          "scale": [
            0.2,
            0.04,
            0.05
          ],
          "material": "flower"
        }
      ]
    }
  },
  "metadata": {
    "radius": 0.6,
    "worldHitHeight": 0.58
  }
}
