{
  "format": "littlewild-3d-asset",
  "schemaVersion": 1,
  "category": "building",
  "id": "well",
  "name": "Stone well",
  "materials": {
    "stone": "#b6bca8",
    "water": "#559399",
    "wood": "#9a7b57",
    "roof": "#688e8b",
    "dark": "#76604a",
    "bucket": "#a88b65"
  },
  "models": {
    "world": {
      "nodes": [
        {
          "primitive": "cylinder",
          "id": "well-wall",
          "position": [
            0,
            0.24,
            0
          ],
          "scale": [
            0.44,
            0.48,
            0.44
          ],
          "material": "stone"
        },
        {
          "primitive": "cylinder",
          "id": "water",
          "position": [
            0,
            0.48,
            0
          ],
          "scale": [
            0.31,
            0.035,
            0.31
          ],
          "material": "water"
        },
        {
          "primitive": "box",
          "id": "post-left",
          "position": [
            -0.42,
            0.82,
            0
          ],
          "scale": [
            0.08,
            0.88,
            0.08
          ],
          "material": "wood"
        },
        {
          "primitive": "box",
          "id": "post-right",
          "position": [
            0.42,
            0.82,
            0
          ],
          "scale": [
            0.08,
            0.88,
            0.08
          ],
          "material": "wood"
        },
        {
          "primitive": "roof",
          "id": "roof",
          "position": [
            0,
            1.16,
            0
          ],
          "scale": [
            1.04,
            0.66,
            0.72
          ],
          "material": "roof"
        },
        {
          "primitive": "cylinder",
          "id": "spindle",
          "position": [
            0,
            0.79,
            0
          ],
          "scale": [
            0.05,
            0.84,
            0.05
          ],
          "material": "dark",
          "rotation": [
            0,
            0,
            1.5707963267948966
          ]
        },
        {
          "primitive": "cylinder",
          "id": "bucket",
          "position": [
            0.12,
            0.44,
            0.12
          ],
          "scale": [
            0.13,
            0.25,
            0.13
          ],
          "material": "bucket"
        }
      ]
    }
  },
  "metadata": {
    "orientation": "none",
    "indoor": false,
    "hitHeight": 1.55,
    "radius": 0.9
  }
}
